{
 "table": "pilot-arrival",
 "sources": [
  "CNA1979:34.88",
  "CNA1979:34.89",
  "CNA1979:34.83",
  "scan:p177",
  "scan:p141"
 ],
 "notes": [
  "Commonwealth (printed 34.86, jp2 141; Commonwealth Charts.pdf p. 31), Italian (34.89a) and German (34.89b, jp2 177; Axis Charts.pdf p. 35) Pilot Arrival Tables, each read twice from the archive.org scan and the community chart PDFs: 0 of 132 cells differ. The rules call the Commonwealth table 34.88.",
  "Two dice, added, once a month per nation in the first Operations Stage's naval convoy arrival phase; pilots lists how many pilots of rating 1, 2, 3 and 4 arrive (no table gives a 5). Commonwealth and Italian: November 1940 to October 1942; German: March 1941 to October 1942.",
  "Marseille, rating 6, joins the Germans in any Operations Stage of Game-Turn 29, without a roll."
 ],
 "ratings": [
  1,
  2,
  3,
  4
 ],
 "nations": [
  {
   "nation": "cw",
   "from": "1940-11",
   "to": "1942-10",
   "rows": [
    {
     "dice": 2,
     "pilots": [
      0,
      0,
      0,
      0
     ]
    },
    {
     "dice": 3,
     "pilots": [
      0,
      3,
      0,
      0
     ]
    },
    {
     "dice": 4,
     "pilots": [
      1,
      0,
      0,
      1
     ]
    },
    {
     "dice": 5,
     "pilots": [
      1,
      2,
      1,
      0
     ]
    },
    {
     "dice": 6,
     "pilots": [
      0,
      1,
      1,
      0
     ]
    },
    {
     "dice": 7,
     "pilots": [
      2,
      4,
      0,
      0
     ]
    },
    {
     "dice": 8,
     "pilots": [
      1,
      3,
      0,
      0
     ]
    },
    {
     "dice": 9,
     "pilots": [
      2,
      0,
      1,
      0
     ]
    },
    {
     "dice": 10,
     "pilots": [
      0,
      1,
      0,
      1
     ]
    },
    {
     "dice": 11,
     "pilots": [
      2,
      1,
      0,
      0
     ]
    },
    {
     "dice": 12,
     "pilots": [
      0,
      0,
      1,
      0
     ]
    }
   ]
  },
  {
   "nation": "it",
   "from": "1940-11",
   "to": "1942-10",
   "rows": [
    {
     "dice": 2,
     "pilots": [
      0,
      0,
      0,
      0
     ]
    },
    {
     "dice": 3,
     "pilots": [
      3,
      0,
      0,
      0
     ]
    },
    {
     "dice": 4,
     "pilots": [
      0,
      1,
      1,
      1
     ]
    },
    {
     "dice": 5,
     "pilots": [
      0,
      2,
      0,
      0
     ]
    },
    {
     "dice": 6,
     "pilots": [
      1,
      0,
      1,
      0
     ]
    },
    {
     "dice": 7,
     "pilots": [
      2,
      1,
      0,
      1
     ]
    },
    {
     "dice": 8,
     "pilots": [
      1,
      0,
      0,
      0
     ]
    },
    {
     "dice": 9,
     "pilots": [
      2,
      1,
      0,
      0
     ]
    },
    {
     "dice": 10,
     "pilots": [
      1,
      0,
      1,
      0
     ]
    },
    {
     "dice": 11,
     "pilots": [
      0,
      0,
      2,
      1
     ]
    },
    {
     "dice": 12,
     "pilots": [
      0,
      3,
      2,
      0
     ]
    }
   ]
  },
  {
   "nation": "de",
   "from": "1941-03",
   "to": "1942-10",
   "rows": [
    {
     "dice": 2,
     "pilots": [
      0,
      0,
      0,
      0
     ]
    },
    {
     "dice": 3,
     "pilots": [
      3,
      0,
      1,
      1
     ]
    },
    {
     "dice": 4,
     "pilots": [
      0,
      3,
      0,
      1
     ]
    },
    {
     "dice": 5,
     "pilots": [
      0,
      2,
      0,
      0
     ]
    },
    {
     "dice": 6,
     "pilots": [
      1,
      1,
      1,
      0
     ]
    },
    {
     "dice": 7,
     "pilots": [
      2,
      0,
      1,
      1
     ]
    },
    {
     "dice": 8,
     "pilots": [
      0,
      2,
      1,
      1
     ]
    },
    {
     "dice": 9,
     "pilots": [
      1,
      0,
      2,
      0
     ]
    },
    {
     "dice": 10,
     "pilots": [
      3,
      0,
      0,
      2
     ]
    },
    {
     "dice": 11,
     "pilots": [
      0,
      1,
      3,
      1
     ]
    },
    {
     "dice": 12,
     "pilots": [
      0,
      0,
      1,
      1
     ]
    }
   ],
   "fixed": [
    {
     "game_turn": 29,
     "rating": 6,
     "pilot": "Hans-Joachim Marseille"
    }
   ]
  }
 ]
}
